{
  "pid": "urn:uuid:bb3197a3-6224-53f9-8176-397af45417e6",
  "pid_estado": "local (URN UUID v5); pendiente de registro en un servicio resoluble",
  "kernel": {
    "digitalObjectType": "https://github.com/emimontuy/carto-visor-evidencia1/blob/main/fdo/tipos/Cita.schema.json",
    "digitalObjectLocation": "https://github.com/emimontuy/carto-visor-evidencia1/blob/main/fdo/objetos/citas/Q09.json",
    "dateCreated": "2026-10-21",
    "version": "1.0.0",
    "license": "LicenseRef-uso-academico-restringido",
    "creator": "Emilio Gómez Montuy",
    "checksum": {
      "algorithm": "sha256",
      "value": "9cebd84b670dc21b0a9aa5b43539872a9af4e57cacc02af51057c23168dea882"
    }
  },
  "metadatos": {
    "titulo": "Cita Q09 · E2, p. 5",
    "descripcion": "Cita literal verificada contra la transcripción anonimizada.",
    "idioma": "es",
    "proyecto": "Carto-Visor (ADIP) · Evidencia 1"
  },
  "datos": {
    "id": "Q09",
    "entrevista": "E2",
    "pagina": 5,
    "texto_literal": "No todo lo que no coincide es un error.",
    "codigos": [
      "T01"
    ],
    "fragmentos": [
      "E2-S26"
    ],
    "transcripcion": "entrevistas/E2_analista_territorial/paquete/01_fuente/transcripcion_por_paginas.txt"
  },
  "relaciones": [
    {
      "tipo": "expresadaPor",
      "objetivo": "urn:uuid:f010fc57-562a-5c24-890b-956553a7e329"
    },
    {
      "tipo": "fragmentoFuente",
      "objetivo": "E2-S26",
      "ruta": "entrevistas/E2_analista_territorial/paquete/02_codificacion/corpus_codificado.json"
    }
  ],
  "procedencia": {
    "metodo": "selección manual y verificación automática de coincidencia literal (scripts/verificar_entrega.py)"
  }
}
