{
  "pid": "urn:uuid:98fd3096-4933-5888-b727-ecb49aa6abd3",
  "pid_estado": "local (URN UUID v5); pendiente de registro en un servicio resoluble",
  "kernel": {
    "digitalObjectType": "https://github.com/emimontuy/carto-visor-evidencia1/blob/main/fdo/tipos/HistoriaDeUsuario.schema.json",
    "digitalObjectLocation": "https://github.com/emimontuy/carto-visor-evidencia1/blob/main/fdo/objetos/historias/HU-03.json",
    "dateCreated": "2026-10-21",
    "version": "1.0.0",
    "license": "CC-BY-4.0",
    "creator": "Emilio Gómez Montuy",
    "checksum": {
      "algorithm": "sha256",
      "value": "d350063e5c702da12370fac0e37ff1ac9ed9553605f7a93a99e875946c9cb2ee"
    }
  },
  "metadatos": {
    "titulo": "Descargar la misma versión con su ficha",
    "descripcion": "Como cartógrafo que reutiliza la capa, quiero descargar la capa con claves, versión y documentación en un solo paquete, para que el archivo conserve su contexto aunque lo reenvíe.",
    "idioma": "es",
    "proyecto": "Carto-Visor (ADIP) · Evidencia 1"
  },
  "datos": {
    "id": "HU-03",
    "prioridad": "P0",
    "titulo": "Descargar la misma versión con su ficha",
    "como": "cartógrafo que reutiliza la capa",
    "quiero": "descargar la capa con claves, versión y documentación en un solo paquete",
    "para": "que el archivo conserve su contexto aunque lo reenvíe",
    "texto": "Como cartógrafo que reutiliza la capa, quiero descargar la capa con claves, versión y documentación en un solo paquete, para que el archivo conserve su contexto aunque lo reenvíe.",
    "criterios_de_aceptacion": [
      "El botón dice si descarga la capa completa o una selección.",
      "Al abrir el archivo, claves y versión coinciden con la ficha.",
      "La documentación viaja dentro del paquete."
    ],
    "elementos_del_visor_ideal": [
      "V6"
    ],
    "historias_de_origen": [
      "E1-US03",
      "E2-US04",
      "E3-US05",
      "E4-US03",
      "E5-US03"
    ]
  },
  "relaciones": [
    {
      "tipo": "satisface",
      "objetivo": "urn:uuid:29cc95f8-0a6d-5088-8302-d5522004b01b"
    },
    {
      "tipo": "expresadaPor",
      "objetivo": "urn:uuid:2a17927f-1324-59bb-ab0c-3e14aad31204"
    },
    {
      "tipo": "evidenciadoPor",
      "objetivo": "urn:uuid:cf3beb41-07ba-59ce-9672-c27e31d30760"
    },
    {
      "tipo": "evidenciadoPor",
      "objetivo": "urn:uuid:06a8f78f-d99e-5911-b2a7-e32776a4515d"
    },
    {
      "tipo": "derivaDe",
      "objetivo": "E1-US03",
      "ruta": "entrevistas/E1_ADIP/paquete/04_desarrollo/historias_de_usuario.json"
    },
    {
      "tipo": "derivaDe",
      "objetivo": "E2-US04",
      "ruta": "entrevistas/E2_analista_territorial/paquete/04_desarrollo/historias_de_usuario.json"
    },
    {
      "tipo": "derivaDe",
      "objetivo": "E3-US05",
      "ruta": "entrevistas/E3_usuaria_administrativa/paquete/04_desarrollo/historias_de_usuario.json"
    },
    {
      "tipo": "derivaDe",
      "objetivo": "E4-US03",
      "ruta": "entrevistas/E4_desarrollador/paquete/04_desarrollo/historias_de_usuario.json"
    },
    {
      "tipo": "derivaDe",
      "objetivo": "E5-US03",
      "ruta": "entrevistas/E5_cartografo/paquete/04_desarrollo/historias_de_usuario.json"
    }
  ],
  "procedencia": {
    "metodo": "consolidación de 48 historias por entrevista en 11 historias transversales",
    "fecha": "2026-10-21"
  }
}
