{
  "pid": "urn:uuid:2cef8a3d-f1e0-5cb8-a6f5-9a2e373d46fd",
  "pid_estado": "local (URN UUID v5); pendiente de registro en un servicio resoluble",
  "kernel": {
    "digitalObjectType": "https://github.com/emimontuy/carto-visor-evidencia1/blob/main/fdo/tipos/Cita.schema.json",
    "digitalObjectLocation": "https://github.com/emimontuy/carto-visor-evidencia1/blob/main/fdo/objetos/citas/Q20.json",
    "dateCreated": "2026-10-21",
    "version": "1.0.0",
    "license": "LicenseRef-uso-academico-restringido",
    "creator": "Emilio Gómez Montuy",
    "checksum": {
      "algorithm": "sha256",
      "value": "24627fad8dbac7a3137c38a6fa45d9cab4d0cd1d7b5d496b87cea24a0ad6af06"
    }
  },
  "metadatos": {
    "titulo": "Cita Q20 · E4, p. 8",
    "descripcion": "Cita literal verificada contra la transcripción anonimizada.",
    "idioma": "es",
    "proyecto": "Carto-Visor (ADIP) · Evidencia 1"
  },
  "datos": {
    "id": "Q20",
    "entrevista": "E4",
    "pagina": 8,
    "texto_literal": "Puedes programar más botones y esa duda sigue ahí.",
    "codigos": [
      "T03"
    ],
    "fragmentos": [
      "E4-S45"
    ],
    "transcripcion": "entrevistas/E4_desarrollador/paquete/01_fuente/transcripcion_por_paginas.txt"
  },
  "relaciones": [
    {
      "tipo": "expresadaPor",
      "objetivo": "urn:uuid:9ed9b4ce-01aa-52b2-a64a-82201d378d06"
    },
    {
      "tipo": "fragmentoFuente",
      "objetivo": "E4-S45",
      "ruta": "entrevistas/E4_desarrollador/paquete/02_codificacion/corpus_codificado.json"
    }
  ],
  "procedencia": {
    "metodo": "selección manual y verificación automática de coincidencia literal (scripts/verificar_entrega.py)"
  }
}
