{
  "pid": "urn:uuid:babfc9bb-eee7-54bc-a070-073da4ace7e0",
  "pid_estado": "local (URN UUID v5); pendiente de registro en un servicio resoluble",
  "kernel": {
    "digitalObjectType": "https://github.com/emimontuy/carto-visor-evidencia1/blob/main/fdo/tipos/Cita.schema.json",
    "digitalObjectLocation": "https://github.com/emimontuy/carto-visor-evidencia1/blob/main/fdo/objetos/citas/Q39.json",
    "dateCreated": "2026-10-21",
    "version": "1.0.0",
    "license": "LicenseRef-uso-academico-restringido",
    "creator": "Emilio Gómez Montuy",
    "checksum": {
      "algorithm": "sha256",
      "value": "064b48131ed3ee74034bfc5ed58029da4a7f4e177bed0555ac20fcb6b0aec7a0"
    }
  },
  "metadatos": {
    "titulo": "Cita Q39 · E4, p. 2",
    "descripcion": "Cita literal verificada contra la transcripción anonimizada.",
    "idioma": "es",
    "proyecto": "Carto-Visor (ADIP) · Evidencia 1"
  },
  "datos": {
    "id": "Q39",
    "entrevista": "E4",
    "pagina": 2,
    "texto_literal": "si una clave tiene ceros al principio, habría que confirmar que no se pierdan al cargarla.",
    "codigos": [
      "T07"
    ],
    "fragmentos": [
      "E4-S08"
    ],
    "transcripcion": "entrevistas/E4_desarrollador/paquete/01_fuente/transcripcion_por_paginas.txt"
  },
  "relaciones": [
    {
      "tipo": "expresadaPor",
      "objetivo": "urn:uuid:9ed9b4ce-01aa-52b2-a64a-82201d378d06"
    },
    {
      "tipo": "fragmentoFuente",
      "objetivo": "E4-S08",
      "ruta": "entrevistas/E4_desarrollador/paquete/02_codificacion/corpus_codificado.json"
    }
  ],
  "procedencia": {
    "metodo": "selección manual y verificación automática de coincidencia literal (scripts/verificar_entrega.py)"
  }
}
