{
  "pid": "urn:uuid:6ace627a-16e9-532c-bc5b-675a1ea14630",
  "pid_estado": "local (URN UUID v5); pendiente de registro en un servicio resoluble",
  "kernel": {
    "digitalObjectType": "https://github.com/emimontuy/carto-visor-evidencia1/blob/main/fdo/tipos/Necesidad.schema.json",
    "digitalObjectLocation": "https://github.com/emimontuy/carto-visor-evidencia1/blob/main/fdo/objetos/necesidades/N1.json",
    "dateCreated": "2026-10-21",
    "version": "1.0.0",
    "license": "CC-BY-4.0",
    "creator": "Emilio Gómez Montuy",
    "checksum": {
      "algorithm": "sha256",
      "value": "971db9490c1ad229229923add37aa1027d77d27f0f702670c64b51d54c798a76"
    }
  },
  "metadatos": {
    "titulo": "Saber qué capa y qué elemento estoy viendo (tipo, clave, nombre, alcance) para usar la referencia adecuada.",
    "descripcion": "Necesidad de información verificable derivada de las entrevistas.",
    "idioma": "es",
    "proyecto": "Carto-Visor (ADIP) · Evidencia 1"
  },
  "datos": {
    "id": "N1",
    "prioridad": "P1",
    "sector": "Consulta institucional",
    "enunciado": "Saber qué capa y qué elemento estoy viendo (tipo, clave, nombre, alcance) para usar la referencia adecuada.",
    "criterio_de_verificacion": "Al seleccionar un elemento, la persona explica qué representa y su clave coincide con la fuente.",
    "perfiles": [
      "P3",
      "P5",
      "P2"
    ]
  },
  "relaciones": [
    {
      "tipo": "evidenciadoPor",
      "objetivo": "urn:uuid:754c7bac-2ccc-59f5-9227-587013e0abfd"
    },
    {
      "tipo": "evidenciadoPor",
      "objetivo": "urn:uuid:bb3197a3-6224-53f9-8176-397af45417e6"
    },
    {
      "tipo": "expresadaPor",
      "objetivo": "urn:uuid:e1472d19-a0d4-5615-845b-21ee745813a5"
    },
    {
      "tipo": "expresadaPor",
      "objetivo": "urn:uuid:2a17927f-1324-59bb-ab0c-3e14aad31204"
    },
    {
      "tipo": "expresadaPor",
      "objetivo": "urn:uuid:f010fc57-562a-5c24-890b-956553a7e329"
    }
  ],
  "procedencia": {
    "metodo": "agrupación de fragmentos por afinidad entre entrevistas",
    "fuentes": [
      "entrevistas/E3_usuaria_administrativa/paquete/01_fuente/E3_transcripcion_anonimizada.pdf",
      "entrevistas/E2_analista_territorial/paquete/01_fuente/E2_transcripcion_anonimizada.pdf"
    ]
  }
}
