{
  "pid": "urn:uuid:22e0fd21-763c-59a8-9cd2-2760b4f50e9e",
  "pid_estado": "local (URN UUID v5); pendiente de registro en un servicio resoluble",
  "kernel": {
    "digitalObjectType": "https://github.com/emimontuy/carto-visor-evidencia1/blob/main/fdo/tipos/Cita.schema.json",
    "digitalObjectLocation": "https://github.com/emimontuy/carto-visor-evidencia1/blob/main/fdo/objetos/citas/Q27.json",
    "dateCreated": "2026-10-21",
    "version": "1.0.0",
    "license": "LicenseRef-uso-academico-restringido",
    "creator": "Emilio Gómez Montuy",
    "checksum": {
      "algorithm": "sha256",
      "value": "277a856aa7a36e198c29b92b1aab0b981c75a0d54d717192f9779ab9e7719fd8"
    }
  },
  "metadatos": {
    "titulo": "Cita Q27 · E1, p. 8",
    "descripcion": "Cita literal verificada contra la transcripción anonimizada.",
    "idioma": "es",
    "proyecto": "Carto-Visor (ADIP) · Evidencia 1"
  },
  "datos": {
    "id": "Q27",
    "entrevista": "E1",
    "pagina": 8,
    "texto_literal": "Obviamente nadie editar, pero descargar",
    "codigos": [
      "T06"
    ],
    "fragmentos": [
      "E1-S21"
    ],
    "transcripcion": "entrevistas/E1_ADIP/paquete/01_fuente/e1_adip_transcripcion_extraida.txt"
  },
  "relaciones": [
    {
      "tipo": "expresadaPor",
      "objetivo": "urn:uuid:8792a5d5-418b-5492-b878-7928aebc993c"
    },
    {
      "tipo": "fragmentoFuente",
      "objetivo": "E1-S21",
      "ruta": "entrevistas/E1_ADIP/paquete/02_codificacion/corpus_codificado.json"
    }
  ],
  "procedencia": {
    "metodo": "selección manual y verificación automática de coincidencia literal (scripts/verificar_entrega.py)"
  }
}
