{
  "pid": "urn:uuid:9ed9b4ce-01aa-52b2-a64a-82201d378d06",
  "pid_estado": "local (URN UUID v5); pendiente de registro en un servicio resoluble",
  "kernel": {
    "digitalObjectType": "https://github.com/emimontuy/carto-visor-evidencia1/blob/main/fdo/tipos/Perfil.schema.json",
    "digitalObjectLocation": "https://github.com/emimontuy/carto-visor-evidencia1/blob/main/fdo/objetos/perfiles/P4.json",
    "dateCreated": "2026-10-21",
    "version": "1.0.0",
    "license": "CC-BY-4.0",
    "creator": "Emilio Gómez Montuy",
    "checksum": {
      "algorithm": "sha256",
      "value": "6da349af84cbc2b530163a6b86994fe2c5ff935dc931c40f268b579396d1558c"
    }
  },
  "metadatos": {
    "titulo": "El desarrollador",
    "descripcion": "Perfil construido a partir de la entrevista E4 (anonimizada).",
    "idioma": "es",
    "proyecto": "Carto-Visor (ADIP) · Evidencia 1"
  },
  "datos": {
    "id": "P4",
    "rol": "El desarrollador",
    "tipo_de_actor": "Construye la herramienta",
    "entrevista": "E4",
    "fecha_entrevista": "2026-10-10",
    "contexto": "Programador remoto en un área relacionada con plataformas de mapas digitales",
    "hace": "Convierte una necesidad en un comportamiento que se puede probar.",
    "le_frena": "Las definiciones ambiguas y esperar que alguien confirme qué significa un dato.",
    "necesita": "Un contrato de datos explícito, ejemplos confirmados por el área y reportes reproducibles."
  },
  "relaciones": [
    {
      "tipo": "evidenciadoPor",
      "objetivo": "urn:uuid:9d730762-3c92-5c8a-8037-4aaa9c63b213"
    },
    {
      "tipo": "derivaDe",
      "objetivo": "entrevistas/E4_desarrollador/paquete/02_codificacion/corpus_codificado.json"
    }
  ],
  "procedencia": {
    "metodo": "síntesis de fragmentos codificados de una entrevista"
  }
}
