{
  "pid": "urn:uuid:58fbb890-66e9-55ae-9120-60b11b5cf25f",
  "pid_estado": "local (URN UUID v5); pendiente de registro en un servicio resoluble",
  "kernel": {
    "digitalObjectType": "https://github.com/emimontuy/carto-visor-evidencia1/blob/main/fdo/tipos/Cita.schema.json",
    "digitalObjectLocation": "https://github.com/emimontuy/carto-visor-evidencia1/blob/main/fdo/objetos/citas/Q18.json",
    "dateCreated": "2026-10-21",
    "version": "1.0.0",
    "license": "LicenseRef-uso-academico-restringido",
    "creator": "Emilio Gómez Montuy",
    "checksum": {
      "algorithm": "sha256",
      "value": "bfddc83666c633107760710fa1a80b56be7d5ccce78ff6fa96ae1b98daf896b4"
    }
  },
  "metadatos": {
    "titulo": "Cita Q18 · E4, p. 6",
    "descripcion": "Cita literal verificada contra la transcripción anonimizada.",
    "idioma": "es",
    "proyecto": "Carto-Visor (ADIP) · Evidencia 1"
  },
  "datos": {
    "id": "Q18",
    "entrevista": "E4",
    "pagina": 6,
    "texto_literal": "Ocultar un botón puede ayudar a la interfaz, pero no basta para impedir una acción.",
    "codigos": [
      "T06"
    ],
    "fragmentos": [
      "E4-S31"
    ],
    "transcripcion": "entrevistas/E4_desarrollador/paquete/01_fuente/transcripcion_por_paginas.txt"
  },
  "relaciones": [
    {
      "tipo": "expresadaPor",
      "objetivo": "urn:uuid:9ed9b4ce-01aa-52b2-a64a-82201d378d06"
    },
    {
      "tipo": "fragmentoFuente",
      "objetivo": "E4-S31",
      "ruta": "entrevistas/E4_desarrollador/paquete/02_codificacion/corpus_codificado.json"
    }
  ],
  "procedencia": {
    "metodo": "selección manual y verificación automática de coincidencia literal (scripts/verificar_entrega.py)"
  }
}
