{
  "pid": "urn:uuid:697ef4a9-f1a0-5c36-bf14-7e78b6d5d02b",
  "pid_estado": "local (URN UUID v5); pendiente de registro en un servicio resoluble",
  "kernel": {
    "digitalObjectType": "https://github.com/emimontuy/carto-visor-evidencia1/blob/main/fdo/tipos/Cita.schema.json",
    "digitalObjectLocation": "https://github.com/emimontuy/carto-visor-evidencia1/blob/main/fdo/objetos/citas/Q17.json",
    "dateCreated": "2026-10-21",
    "version": "1.0.0",
    "license": "LicenseRef-uso-academico-restringido",
    "creator": "Emilio Gómez Montuy",
    "checksum": {
      "algorithm": "sha256",
      "value": "84623e24823a0f1c421c5953a74b2f1c50f9fb37a3df3355b6309299e571f1d2"
    }
  },
  "metadatos": {
    "titulo": "Cita Q17 · E4, p. 2",
    "descripcion": "Cita literal verificada contra la transcripción anonimizada.",
    "idioma": "es",
    "proyecto": "Carto-Visor (ADIP) · Evidencia 1"
  },
  "datos": {
    "id": "Q17",
    "entrevista": "E4",
    "pagina": 2,
    "texto_literal": "yo no puedo decidir la realidad del territorio viendo el código.",
    "codigos": [
      "T03",
      "T08"
    ],
    "fragmentos": [
      "E4-S07"
    ],
    "transcripcion": "entrevistas/E4_desarrollador/paquete/01_fuente/transcripcion_por_paginas.txt"
  },
  "relaciones": [
    {
      "tipo": "expresadaPor",
      "objetivo": "urn:uuid:9ed9b4ce-01aa-52b2-a64a-82201d378d06"
    },
    {
      "tipo": "fragmentoFuente",
      "objetivo": "E4-S07",
      "ruta": "entrevistas/E4_desarrollador/paquete/02_codificacion/corpus_codificado.json"
    }
  ],
  "procedencia": {
    "metodo": "selección manual y verificación automática de coincidencia literal (scripts/verificar_entrega.py)"
  }
}
