{
  "pid": "urn:uuid:3df79cea-74e9-5f97-82e2-d018bc11d3a2",
  "pid_estado": "local (URN UUID v5); pendiente de registro en un servicio resoluble",
  "kernel": {
    "digitalObjectType": "https://github.com/emimontuy/carto-visor-evidencia1/blob/main/fdo/tipos/Cita.schema.json",
    "digitalObjectLocation": "https://github.com/emimontuy/carto-visor-evidencia1/blob/main/fdo/objetos/citas/Q05.json",
    "dateCreated": "2026-10-21",
    "version": "1.0.0",
    "license": "LicenseRef-uso-academico-restringido",
    "creator": "Emilio Gómez Montuy",
    "checksum": {
      "algorithm": "sha256",
      "value": "83d8ec2abb7f319451c2c3f6d8ea4bf34ec97dcd205b8c94545d3812c6ac2e17"
    }
  },
  "metadatos": {
    "titulo": "Cita Q05 · E1, p. 7",
    "descripcion": "Cita literal verificada contra la transcripción anonimizada.",
    "idioma": "es",
    "proyecto": "Carto-Visor (ADIP) · Evidencia 1"
  },
  "datos": {
    "id": "Q05",
    "entrevista": "E1",
    "pagina": 7,
    "texto_literal": "me lo proporcionan como de manera en corto, por WhatsApp, algunos se tienen que hacer por oficio",
    "codigos": [
      "T04"
    ],
    "fragmentos": [
      "E1-S16"
    ],
    "transcripcion": "entrevistas/E1_ADIP/paquete/01_fuente/e1_adip_transcripcion_extraida.txt"
  },
  "relaciones": [
    {
      "tipo": "expresadaPor",
      "objetivo": "urn:uuid:8792a5d5-418b-5492-b878-7928aebc993c"
    },
    {
      "tipo": "fragmentoFuente",
      "objetivo": "E1-S16",
      "ruta": "entrevistas/E1_ADIP/paquete/02_codificacion/corpus_codificado.json"
    }
  ],
  "procedencia": {
    "metodo": "selección manual y verificación automática de coincidencia literal (scripts/verificar_entrega.py)"
  }
}
