{
  "pid": "urn:uuid:29cc95f8-0a6d-5088-8302-d5522004b01b",
  "pid_estado": "local (URN UUID v5); pendiente de registro en un servicio resoluble",
  "kernel": {
    "digitalObjectType": "https://github.com/emimontuy/carto-visor-evidencia1/blob/main/fdo/tipos/Necesidad.schema.json",
    "digitalObjectLocation": "https://github.com/emimontuy/carto-visor-evidencia1/blob/main/fdo/objetos/necesidades/N3.json",
    "dateCreated": "2026-10-21",
    "version": "1.0.0",
    "license": "CC-BY-4.0",
    "creator": "Emilio Gómez Montuy",
    "checksum": {
      "algorithm": "sha256",
      "value": "50fcfb01cab71c2be70c9930a8997b8fdc5f06877654ec8c53fe79fc188f4eab"
    }
  },
  "metadatos": {
    "titulo": "Descargar la misma versión que consulté, con claves y documentación.",
    "descripcion": "Necesidad de información verificable derivada de las entrevistas.",
    "idioma": "es",
    "proyecto": "Carto-Visor (ADIP) · Evidencia 1"
  },
  "datos": {
    "id": "N3",
    "prioridad": "P1",
    "sector": "Reutilización cartográfica",
    "enunciado": "Descargar la misma versión que consulté, con claves y documentación.",
    "criterio_de_verificacion": "Abre el archivo y coinciden claves, campos y versión con la ficha.",
    "perfiles": [
      "P2",
      "P5"
    ]
  },
  "relaciones": [
    {
      "tipo": "evidenciadoPor",
      "objetivo": "urn:uuid:cf3beb41-07ba-59ce-9672-c27e31d30760"
    },
    {
      "tipo": "evidenciadoPor",
      "objetivo": "urn:uuid:f7082ac3-5a8e-5c3a-9460-082fa9c67fb3"
    },
    {
      "tipo": "expresadaPor",
      "objetivo": "urn:uuid:f010fc57-562a-5c24-890b-956553a7e329"
    },
    {
      "tipo": "expresadaPor",
      "objetivo": "urn:uuid:2a17927f-1324-59bb-ab0c-3e14aad31204"
    }
  ],
  "procedencia": {
    "metodo": "agrupación de fragmentos por afinidad entre entrevistas",
    "fuentes": [
      "entrevistas/E2_analista_territorial/paquete/01_fuente/E2_transcripcion_anonimizada.pdf",
      "entrevistas/E2_analista_territorial/paquete/01_fuente/E2_transcripcion_anonimizada.pdf"
    ]
  }
}
