{
  "pid": "urn:uuid:86340fa4-ea40-5f22-bd89-44763803aae2",
  "pid_estado": "local (URN UUID v5); pendiente de registro en un servicio resoluble",
  "kernel": {
    "digitalObjectType": "https://github.com/emimontuy/carto-visor-evidencia1/blob/main/fdo/tipos/Cita.schema.json",
    "digitalObjectLocation": "https://github.com/emimontuy/carto-visor-evidencia1/blob/main/fdo/objetos/citas/Q43.json",
    "dateCreated": "2026-10-21",
    "version": "1.0.0",
    "license": "LicenseRef-uso-academico-restringido",
    "creator": "Emilio Gómez Montuy",
    "checksum": {
      "algorithm": "sha256",
      "value": "8c21cc865a3f9f297a478643b72e3f68245bf291c0f36dbb4fe08fb4dd4e8df8"
    }
  },
  "metadatos": {
    "titulo": "Cita Q43 · E5, p. 10",
    "descripcion": "Cita literal verificada contra la transcripción anonimizada.",
    "idioma": "es",
    "proyecto": "Carto-Visor (ADIP) · Evidencia 1"
  },
  "datos": {
    "id": "Q43",
    "entrevista": "E5",
    "pagina": 10,
    "texto_literal": "Que una dependencia pueda tener acceso no demuestra que las vaya a usar.",
    "codigos": [
      "T09"
    ],
    "fragmentos": [
      "E5-S59"
    ],
    "transcripcion": "entrevistas/E5_cartografo/paquete/01_fuente/transcripcion_por_paginas.txt"
  },
  "relaciones": [
    {
      "tipo": "expresadaPor",
      "objetivo": "urn:uuid:2a17927f-1324-59bb-ab0c-3e14aad31204"
    },
    {
      "tipo": "fragmentoFuente",
      "objetivo": "E5-S59",
      "ruta": "entrevistas/E5_cartografo/paquete/02_codificacion/corpus_codificado.json"
    }
  ],
  "procedencia": {
    "metodo": "selección manual y verificación automática de coincidencia literal (scripts/verificar_entrega.py)"
  }
}
