{
  "pid": "urn:uuid:40ae8c18-b006-57a8-ae92-e9fd62e9cc34",
  "pid_estado": "local (URN UUID v5); pendiente de registro en un servicio resoluble",
  "kernel": {
    "digitalObjectType": "https://github.com/emimontuy/carto-visor-evidencia1/blob/main/fdo/tipos/Cita.schema.json",
    "digitalObjectLocation": "https://github.com/emimontuy/carto-visor-evidencia1/blob/main/fdo/objetos/citas/Q46.json",
    "dateCreated": "2026-10-21",
    "version": "1.0.0",
    "license": "LicenseRef-uso-academico-restringido",
    "creator": "Emilio Gómez Montuy",
    "checksum": {
      "algorithm": "sha256",
      "value": "51f3187c0c479845f5ceb72a9150ddb133af4a46571aa52783622d1282b1e600"
    }
  },
  "metadatos": {
    "titulo": "Cita Q46 · E3, p. 5",
    "descripcion": "Cita literal verificada contra la transcripción anonimizada.",
    "idioma": "es",
    "proyecto": "Carto-Visor (ADIP) · Evidencia 1"
  },
  "datos": {
    "id": "Q46",
    "entrevista": "E3",
    "pagina": 5,
    "texto_literal": "No sabría qué hacer con un archivo técnico de un mapa.",
    "codigos": [
      "T05",
      "T07"
    ],
    "fragmentos": [
      "E3-S31"
    ],
    "transcripcion": "entrevistas/E3_usuaria_administrativa/paquete/01_fuente/transcripcion_por_paginas.txt"
  },
  "relaciones": [
    {
      "tipo": "expresadaPor",
      "objetivo": "urn:uuid:e1472d19-a0d4-5615-845b-21ee745813a5"
    },
    {
      "tipo": "fragmentoFuente",
      "objetivo": "E3-S31",
      "ruta": "entrevistas/E3_usuaria_administrativa/paquete/02_codificacion/corpus_codificado.json"
    }
  ],
  "procedencia": {
    "metodo": "selección manual y verificación automática de coincidencia literal (scripts/verificar_entrega.py)"
  }
}
