{
  "pid": "urn:uuid:d0b7f62d-a4b2-5f21-ba8e-24a4f0022503",
  "pid_estado": "local (URN UUID v5); pendiente de registro en un servicio resoluble",
  "kernel": {
    "digitalObjectType": "https://github.com/emimontuy/carto-visor-evidencia1/blob/main/fdo/tipos/Cita.schema.json",
    "digitalObjectLocation": "https://github.com/emimontuy/carto-visor-evidencia1/blob/main/fdo/objetos/citas/Q13.json",
    "dateCreated": "2026-10-21",
    "version": "1.0.0",
    "license": "LicenseRef-uso-academico-restringido",
    "creator": "Emilio Gómez Montuy",
    "checksum": {
      "algorithm": "sha256",
      "value": "d69931f56f0b4da5bdaf897eeac74c681d403569becebcd62206550fb96af56a"
    }
  },
  "metadatos": {
    "titulo": "Cita Q13 · E3, p. 4",
    "descripcion": "Cita literal verificada contra la transcripción anonimizada.",
    "idioma": "es",
    "proyecto": "Carto-Visor (ADIP) · Evidencia 1"
  },
  "datos": {
    "id": "Q13",
    "entrevista": "E3",
    "pagina": 4,
    "texto_literal": "Yo no sabría qué abrir si un botón dijera solamente “metadatos”.",
    "codigos": [
      "T05"
    ],
    "fragmentos": [
      "E3-S21"
    ],
    "transcripcion": "entrevistas/E3_usuaria_administrativa/paquete/01_fuente/transcripcion_por_paginas.txt"
  },
  "relaciones": [
    {
      "tipo": "expresadaPor",
      "objetivo": "urn:uuid:e1472d19-a0d4-5615-845b-21ee745813a5"
    },
    {
      "tipo": "fragmentoFuente",
      "objetivo": "E3-S21",
      "ruta": "entrevistas/E3_usuaria_administrativa/paquete/02_codificacion/corpus_codificado.json"
    }
  ],
  "procedencia": {
    "metodo": "selección manual y verificación automática de coincidencia literal (scripts/verificar_entrega.py)"
  }
}
