{
  "pid": "urn:uuid:4dc8058c-d35f-5e61-8c27-77f02b23597d",
  "pid_estado": "local (URN UUID v5); pendiente de registro en un servicio resoluble",
  "kernel": {
    "digitalObjectType": "https://github.com/emimontuy/carto-visor-evidencia1/blob/main/fdo/tipos/HistoriaDeUsuario.schema.json",
    "digitalObjectLocation": "https://github.com/emimontuy/carto-visor-evidencia1/blob/main/fdo/objetos/historias/HU-01.json",
    "dateCreated": "2026-10-21",
    "version": "1.0.0",
    "license": "CC-BY-4.0",
    "creator": "Emilio Gómez Montuy",
    "checksum": {
      "algorithm": "sha256",
      "value": "8541103321f98faa1161d21ba4363fe8837138e5dc29b091a0e39a2abf47bd7e"
    }
  },
  "metadatos": {
    "titulo": "Saber qué estoy viendo",
    "descripcion": "Como persona autorizada que consulta el visor, quiero activar sectores o cuadrantes y, al seleccionar uno, ver su tipo, clave y nombre, para no confundir una zona operativa con una colonia.",
    "idioma": "es",
    "proyecto": "Carto-Visor (ADIP) · Evidencia 1"
  },
  "datos": {
    "id": "HU-01",
    "prioridad": "P0",
    "titulo": "Saber qué estoy viendo",
    "como": "persona autorizada que consulta el visor",
    "quiero": "activar sectores o cuadrantes y, al seleccionar uno, ver su tipo, clave y nombre",
    "para": "no confundir una zona operativa con una colonia",
    "texto": "Como persona autorizada que consulta el visor, quiero activar sectores o cuadrantes y, al seleccionar uno, ver su tipo, clave y nombre, para no confundir una zona operativa con una colonia.",
    "criterios_de_aceptacion": [
      "La capa activa y su leyenda son visibles y no dependen sólo del color.",
      "La ficha muestra la clave exactamente como la entrega la SSC.",
      "La selección del mapa y la de la ficha siempre coinciden."
    ],
    "elementos_del_visor_ideal": [
      "V2",
      "V3"
    ],
    "historias_de_origen": [
      "E1-US02",
      "E2-US01",
      "E3-US02",
      "E4-US01",
      "E4-US05",
      "E5-US01"
    ]
  },
  "relaciones": [
    {
      "tipo": "satisface",
      "objetivo": "urn:uuid:6ace627a-16e9-532c-bc5b-675a1ea14630"
    },
    {
      "tipo": "expresadaPor",
      "objetivo": "urn:uuid:e1472d19-a0d4-5615-845b-21ee745813a5"
    },
    {
      "tipo": "evidenciadoPor",
      "objetivo": "urn:uuid:754c7bac-2ccc-59f5-9227-587013e0abfd"
    },
    {
      "tipo": "evidenciadoPor",
      "objetivo": "urn:uuid:3aa6e75b-8800-56b6-8138-bbbffffbd400"
    },
    {
      "tipo": "derivaDe",
      "objetivo": "E1-US02",
      "ruta": "entrevistas/E1_ADIP/paquete/04_desarrollo/historias_de_usuario.json"
    },
    {
      "tipo": "derivaDe",
      "objetivo": "E2-US01",
      "ruta": "entrevistas/E2_analista_territorial/paquete/04_desarrollo/historias_de_usuario.json"
    },
    {
      "tipo": "derivaDe",
      "objetivo": "E3-US02",
      "ruta": "entrevistas/E3_usuaria_administrativa/paquete/04_desarrollo/historias_de_usuario.json"
    },
    {
      "tipo": "derivaDe",
      "objetivo": "E4-US01",
      "ruta": "entrevistas/E4_desarrollador/paquete/04_desarrollo/historias_de_usuario.json"
    },
    {
      "tipo": "derivaDe",
      "objetivo": "E4-US05",
      "ruta": "entrevistas/E4_desarrollador/paquete/04_desarrollo/historias_de_usuario.json"
    },
    {
      "tipo": "derivaDe",
      "objetivo": "E5-US01",
      "ruta": "entrevistas/E5_cartografo/paquete/04_desarrollo/historias_de_usuario.json"
    }
  ],
  "procedencia": {
    "metodo": "consolidación de 48 historias por entrevista en 11 historias transversales",
    "fecha": "2026-10-21"
  }
}
