{
  "pid": "urn:uuid:e268004d-ccd4-5212-b0fd-4aa99eb179ee",
  "pid_estado": "local (URN UUID v5); pendiente de registro en un servicio resoluble",
  "kernel": {
    "digitalObjectType": "https://github.com/emimontuy/carto-visor-evidencia1/blob/main/fdo/tipos/HistoriaDeUsuario.schema.json",
    "digitalObjectLocation": "https://github.com/emimontuy/carto-visor-evidencia1/blob/main/fdo/objetos/historias/HU-09.json",
    "dateCreated": "2026-10-21",
    "version": "1.0.0",
    "license": "CC-BY-4.0",
    "creator": "Emilio Gómez Montuy",
    "checksum": {
      "algorithm": "sha256",
      "value": "24136ecb5f6fb160f4e8823dcbe1814be802ff1f8f68cd84ac0e55c5193f2a4b"
    }
  },
  "metadatos": {
    "titulo": "Retomar el proyecto sin depender de nadie",
    "descripcion": "Como persona que recibe el proyecto en una fase 2, quiero encontrar versiones de datos y código, decisiones y pendientes, y ejecutarlo en local, para continuar sin reconstruir la historia por mensajes.",
    "idioma": "es",
    "proyecto": "Carto-Visor (ADIP) · Evidencia 1"
  },
  "datos": {
    "id": "HU-09",
    "prioridad": "P1",
    "titulo": "Retomar el proyecto sin depender de nadie",
    "como": "persona que recibe el proyecto en una fase 2",
    "quiero": "encontrar versiones de datos y código, decisiones y pendientes, y ejecutarlo en local",
    "para": "continuar sin reconstruir la historia por mensajes",
    "texto": "Como persona que recibe el proyecto en una fase 2, quiero encontrar versiones de datos y código, decisiones y pendientes, y ejecutarlo en local, para continuar sin reconstruir la historia por mensajes.",
    "criterios_de_aceptacion": [
      "Cada entrega semanal queda en una carpeta compartida con su documentación.",
      "Hay una consulta verificada que se puede repetir.",
      "Se ejecuta sin servicios de pago obligatorios."
    ],
    "elementos_del_visor_ideal": [],
    "historias_de_origen": [
      "E1-US07",
      "E1-US08",
      "E2-US08",
      "E4-US09",
      "E5-US10"
    ]
  },
  "relaciones": [
    {
      "tipo": "satisface",
      "objetivo": "urn:uuid:e15625ba-831c-5d3b-b80c-743bb3755c7a"
    },
    {
      "tipo": "expresadaPor",
      "objetivo": "urn:uuid:8792a5d5-418b-5492-b878-7928aebc993c"
    },
    {
      "tipo": "evidenciadoPor",
      "objetivo": "urn:uuid:782697f2-130d-5393-b42a-ddbb03f1a824"
    },
    {
      "tipo": "evidenciadoPor",
      "objetivo": "urn:uuid:a57bb30b-75be-52a0-a8ef-41edda2e1516"
    },
    {
      "tipo": "derivaDe",
      "objetivo": "E1-US07",
      "ruta": "entrevistas/E1_ADIP/paquete/04_desarrollo/historias_de_usuario.json"
    },
    {
      "tipo": "derivaDe",
      "objetivo": "E1-US08",
      "ruta": "entrevistas/E1_ADIP/paquete/04_desarrollo/historias_de_usuario.json"
    },
    {
      "tipo": "derivaDe",
      "objetivo": "E2-US08",
      "ruta": "entrevistas/E2_analista_territorial/paquete/04_desarrollo/historias_de_usuario.json"
    },
    {
      "tipo": "derivaDe",
      "objetivo": "E4-US09",
      "ruta": "entrevistas/E4_desarrollador/paquete/04_desarrollo/historias_de_usuario.json"
    },
    {
      "tipo": "derivaDe",
      "objetivo": "E5-US10",
      "ruta": "entrevistas/E5_cartografo/paquete/04_desarrollo/historias_de_usuario.json"
    }
  ],
  "procedencia": {
    "metodo": "consolidación de 48 historias por entrevista en 11 historias transversales",
    "fecha": "2026-10-21"
  }
}
