{
  "pid": "urn:uuid:f202db6b-9e57-5a01-b301-cd26ca3fefea",
  "pid_estado": "local (URN UUID v5); pendiente de registro en un servicio resoluble",
  "kernel": {
    "digitalObjectType": "https://github.com/emimontuy/carto-visor-evidencia1/blob/main/fdo/tipos/HistoriaDeUsuario.schema.json",
    "digitalObjectLocation": "https://github.com/emimontuy/carto-visor-evidencia1/blob/main/fdo/objetos/historias/HU-08.json",
    "dateCreated": "2026-10-21",
    "version": "1.0.0",
    "license": "CC-BY-4.0",
    "creator": "Emilio Gómez Montuy",
    "checksum": {
      "algorithm": "sha256",
      "value": "50273bb94154cd8057c7cc1a2c60f1ac8a9448efb96f010fb36424ab72864fa1"
    }
  },
  "metadatos": {
    "titulo": "Cargar la capa sin alterar la fuente",
    "descripcion": "Como desarrollador que incorpora capas, quiero un contrato de datos con campos, claves y referencia espacial, y una carga de prueba, para mostrar exactamente lo que entregó la SSC.",
    "idioma": "es",
    "proyecto": "Carto-Visor (ADIP) · Evidencia 1"
  },
  "datos": {
    "id": "HU-08",
    "prioridad": "P1",
    "titulo": "Cargar la capa sin alterar la fuente",
    "como": "desarrollador que incorpora capas",
    "quiero": "un contrato de datos con campos, claves y referencia espacial, y una carga de prueba",
    "para": "mostrar exactamente lo que entregó la SSC",
    "texto": "Como desarrollador que incorpora capas, quiero un contrato de datos con campos, claves y referencia espacial, y una carga de prueba, para mostrar exactamente lo que entregó la SSC.",
    "criterios_de_aceptacion": [
      "Se conserva el paquete original y su huella.",
      "Las claves conservan ceros iniciales y formato texto.",
      "Se comprueba una muestra con ejemplos que confirme el área."
    ],
    "elementos_del_visor_ideal": [],
    "historias_de_origen": [
      "E1-US06",
      "E2-US07",
      "E4-US06",
      "E5-US07"
    ]
  },
  "relaciones": [
    {
      "tipo": "satisface",
      "objetivo": "urn:uuid:6ace627a-16e9-532c-bc5b-675a1ea14630"
    },
    {
      "tipo": "satisface",
      "objetivo": "urn:uuid:29cc95f8-0a6d-5088-8302-d5522004b01b"
    },
    {
      "tipo": "expresadaPor",
      "objetivo": "urn:uuid:9ed9b4ce-01aa-52b2-a64a-82201d378d06"
    },
    {
      "tipo": "evidenciadoPor",
      "objetivo": "urn:uuid:babfc9bb-eee7-54bc-a070-073da4ace7e0"
    },
    {
      "tipo": "evidenciadoPor",
      "objetivo": "urn:uuid:697ef4a9-f1a0-5c36-bf14-7e78b6d5d02b"
    },
    {
      "tipo": "derivaDe",
      "objetivo": "E1-US06",
      "ruta": "entrevistas/E1_ADIP/paquete/04_desarrollo/historias_de_usuario.json"
    },
    {
      "tipo": "derivaDe",
      "objetivo": "E2-US07",
      "ruta": "entrevistas/E2_analista_territorial/paquete/04_desarrollo/historias_de_usuario.json"
    },
    {
      "tipo": "derivaDe",
      "objetivo": "E4-US06",
      "ruta": "entrevistas/E4_desarrollador/paquete/04_desarrollo/historias_de_usuario.json"
    },
    {
      "tipo": "derivaDe",
      "objetivo": "E5-US07",
      "ruta": "entrevistas/E5_cartografo/paquete/04_desarrollo/historias_de_usuario.json"
    }
  ],
  "procedencia": {
    "metodo": "consolidación de 48 historias por entrevista en 11 historias transversales",
    "fecha": "2026-10-21"
  }
}
