{
  "pid": "urn:uuid:46c44e29-acfe-5e88-aa17-41e4009e3167",
  "pid_estado": "local (URN UUID v5); pendiente de registro en un servicio resoluble",
  "kernel": {
    "digitalObjectType": "https://github.com/emimontuy/carto-visor-evidencia1/blob/main/fdo/tipos/Necesidad.schema.json",
    "digitalObjectLocation": "https://github.com/emimontuy/carto-visor-evidencia1/blob/main/fdo/objetos/necesidades/N4.json",
    "dateCreated": "2026-10-21",
    "version": "1.0.0",
    "license": "CC-BY-4.0",
    "creator": "Emilio Gómez Montuy",
    "checksum": {
      "algorithm": "sha256",
      "value": "b551e9a1f520e00d07ff608a358130860f1f25c8f618e3c9f8162d757fd922e3"
    }
  },
  "metadatos": {
    "titulo": "Entender opciones y límites sin capacitación previa.",
    "descripcion": "Necesidad de información verificable derivada de las entrevistas.",
    "idioma": "es",
    "proyecto": "Carto-Visor (ADIP) · Evidencia 1"
  },
  "datos": {
    "id": "N4",
    "prioridad": "P1",
    "sector": "Consulta administrativa",
    "enunciado": "Entender opciones y límites sin capacitación previa.",
    "criterio_de_verificacion": "Completa una tarea sin guía e identifica qué debe confirmar con alguien.",
    "perfiles": [
      "P3",
      "P1"
    ]
  },
  "relaciones": [
    {
      "tipo": "evidenciadoPor",
      "objetivo": "urn:uuid:64d24c47-37af-5d2b-b7bd-9d7dac05b01c"
    },
    {
      "tipo": "evidenciadoPor",
      "objetivo": "urn:uuid:d0b7f62d-a4b2-5f21-ba8e-24a4f0022503"
    },
    {
      "tipo": "expresadaPor",
      "objetivo": "urn:uuid:e1472d19-a0d4-5615-845b-21ee745813a5"
    },
    {
      "tipo": "expresadaPor",
      "objetivo": "urn:uuid:8792a5d5-418b-5492-b878-7928aebc993c"
    }
  ],
  "procedencia": {
    "metodo": "agrupación de fragmentos por afinidad entre entrevistas",
    "fuentes": [
      "entrevistas/E1_ADIP/paquete/01_fuente/E1_transcripcion_anonimizada.pdf",
      "entrevistas/E3_usuaria_administrativa/paquete/01_fuente/E3_transcripcion_anonimizada.pdf"
    ]
  }
}
